Title,Heading,Content
The C++ API,Performing Inference,"The engine holds the optimized model, but to perform inference we must manage additional state for intermediate activations. This is done using the ExecutionContext interface: IExecutionContext *context = engine->createExecutionContext(); An engine can have multiple execution contexts, allowing one set of weights to be used for multiple overlapping inference tasks. (A current exception to this is when using dynamic shapes, when each optimization profile can only have one execution context.) To perform inference, you must pass TensorRT buffers for input and output, which TensorRT requires you to specify with calls to setTensorAddress, which takes the name of the tensor and the address of the buffer. You can query the engine using the names you provided for input and output tensors to find the right positions in the array: context->setTensorAddress(INPUT_NAME, inputBuffer); context->setTensorAddress(OUTPUT_NAME, outputBuffer); You can then call TensorRT’s method enqueueV3 to start inference asynchronously using a CUDA stream: context->enqueueV3(stream); It is common to enqueue data transfers with cudaMemcpyAsync() before and after the kernels to move data from the GPU if it is not already there. To determine when the kernels (and possibly cudaMemcpyAsyn()) are complete, use standard CUDA synchronization mechanisms such as events or waiting on the stream."
The Python API,Introduction,"This chapter illustrates basic usage of the Python API, assuming you are starting with an ONNX model. The onnx_resnet50.py sample illustrates this use case in more detail. The Python API can be accessed through the tensorrt module: import tensorrt as trt"
The Python API,The Build Phase,"To create a builder, you must first create a logger. The Python bindings include a simple logger implementation that logs all messages preceding a certain severity to stdout. logger = trt.Logger(trt.Logger.WARNING) Alternatively, it is possible to define your own implementation of the logger by deriving from the ILogger class: class MyLogger(trt.ILogger): def __init__(self): trt.ILogger.__init__(self) def log(self, severity, msg): pass # Your custom logging implementation here. logger = MyLogger() You can then create a builder: builder = trt.Builder(logger) Since building engines is intended as an offline process, it can take significant time. Refer to the Optimizing Builder Performance section for how to make the builder run faster."
The Python API,Creating a Network Definition,"After the builder has been created, the first step in optimizing a model is to create a network definition: network = builder.create_network(1 << int(trt.NetworkDefinitionCreationFlag.EXPLICIT_BATCH)) The EXPLICIT_BATCH flag is required in order to import models using the ONNX parser. Refer to the Explicit Versus Implicit Batch section for more information."
The Python API,Importing a Model Using the ONNX Parser,"Now, the network definition must be populated from the ONNX representation. You can create an ONNX parser to populate the network as follows: parser = trt.OnnxParser(network, logger) Then, read the model file and process any errors: success = parser.parse_from_file(model_path) for idx in range(parser.num_errors): print(parser.get_error(idx)) if not success: pass # Error handling code here"
The Python API,Building an Engine,"The next step is to create a build configuration specifying how TensorRT should optimize the model: config = builder.create_builder_config() This interface has many properties that you can set in order to control how TensorRT optimizes the network. One important property is the maximum workspace size. Layer implementations often require a temporary workspace, and this parameter limits the maximum size that any layer in the network can use. If insufficient workspace is provided, it is possible that TensorRT will not be able to find an implementation for a layer: config.set_memory_pool_limit(trt.MemoryPoolType.WORKSPACE, 1 << 20) # 1 MiB After the configuration has been specified, the engine can be built and serialized with: serialized_engine = builder.build_serialized_network(network, config) It may be useful to save the engine to a file for future use. You can do that like so: with open(“sample.engine”, “wb”) as f: f.write(serialized_engine) Note: Serialized engines are not portable across platforms or TensorRT versions. Engines are specific to the exact GPU model that they were built on (in addition to the platform and the TensorRT version)."
The Python API,Deserializing a Plan,"To perform inference, deserialize the engine using the Runtime interface. Like the builder, the runtime requires an instance of the logger. runtime = trt.Runtime(logger) You can then deserialize the engine from a memory buffer: engine = runtime.deserialize_cuda_engine(serialized_engine) If you want, first load the engine from a file: with open(“sample.engine”, “rb”) as f: serialized_engine = f.read()"
The Python API,Performing Inference,"The engine holds the optimized model, but to perform inference requires additional state for intermediate activations. This is done using the IExecutionContext interface: context = engine.create_execution_context() An engine can have multiple execution contexts, allowing one set of weights to be used for multiple overlapping inference tasks. (A current exception to this is when using dynamic shapes, when each optimization profile can only have one execution context.) To perform inference, you must specify buffers for inputs and outputs: context.set_tensor_address(name, ptr) Several Python packages allow you to allocate memory on the GPU, including, but not limited to,the official CUDA Python bindings, PyTorch, cuPy, and Numba. After populating the input buffer, you can call TensorRT’s execute_async_v3 method to start inference asynchronously using a CUDA stream. First, create the CUDA stream. If you already have a CUDA stream, you can use a pointer to the existing stream. For example, for PyTorch CUDA streams, that is torch.cuda.Stream(), you can access the pointer using the cuda_stream property; for Polygraphy CUDA streams, use the ptr attribute. Next, start inference: context.execute_async_v3(buffers, stream_ptr) It is common to enqueue asynchronous transfers (cudaMemcpyAsync()) before and after the kernels to move data from the GPU if it is not already there. To determine when inference (and asynchronous transfers) are complete, use the standard CUDA synchronization mechanisms such as events or waiting on the stream. For example, with Polygraphy, use: stream.synchronize()"
How TensorRT Works,Object Lifetimes,"TensorRT’s API is class-based, with some classes acting as factories for other classes. For objects owned by the user, the lifetime of a factory object must span the lifetime of objects it creates. For example, the NetworkDefinition and BuilderConfig classes are created from the builder class, and objects of those classes should be destroyed before the builder factory object. An important exception to this rule is creating an engine from a builder. After you have created an engine, you may destroy the builder, network, parser, and build config and continue using the engine."
How TensorRT Works,Error Handling and Logging,"When creating TensorRT top-level interfaces (builder, runtime or refitter), you must provide an implementation of the Logger (C++, Python) interface. The logger is used for diagnostics and informational messages; its verbosity level is configurable. Since the logger may be used to pass back information at any point in the lifetime of TensorRT, its lifetime must span any use of that interface in your application. The implementation must also be thread-safe, since TensorRT may use worker threads internally. An API call to an object will use the logger associated with the corresponding top-level interface. For example, in a call to ExecutionContext::enqueueV3(), the execution context was created from an engine, which was created from a runtime, so TensorRT will use the logger associated with that runtime. The primary method of error handling is the ErrorRecorder (C++, Python) interface. You can implement this interface, and attach it to an API object to receive errors associated with that object. The recorder for an object will also be passed to any others it creates - for example, if you attach an error recorder to an engine, and create an execution context from that engine, it will use the same recorder. If you then attach a new error recorder to the execution context, it will receive only errors coming from that context. If an error is generated but no error recorder is found, it will be emitted through the associated logger. Note that CUDA errors are generally asynchronous - so when performing multiple inferences or other streams of CUDA work asynchronously in a single CUDA context, an asynchronous GPU error may be observed in a different execution context than the one that generated it."
How TensorRT Works,Memory,"TensorRT uses considerable amounts of device memory, that is, memory directly accessible by the GPU, as opposed to the host memory attached to the CPU). Since device memory is often a constrained resource, it is important to understand how TensorRT uses it."
How TensorRT Works,Memory - The Build Phase,"During build, TensorRT allocates device memory for timing layer implementations. Some implementations can consume a large amount of temporary memory, especially with large tensors. You can control the maximum amount of temporary memory through the builder’s maxWorkspace attribute. This defaults to the full size of device global memory but can be restricted when necessary. If the builder finds applicable kernels that could not be run because of insufficient workspace, it will emit a logging message indicating this. Even with relatively little workspace however, timing requires creating buffers for input, output, and weights. TensorRT is robust against the operating system (OS) returning out-of-memory for such allocations. On some platforms the OS may successfully provide memory, which then the out-of-memory killer process observes that the system is low on memory, and kills TensorRT. If this happens free up as much system memory as possible before retrying. During the build phase, there will typically be at least two copies of the weights in host memory: those from the original network, and those included as part of the engine as it is built. In addition, when TensorRT combines weights (for example convolution with batch normalization) additional temporary weight tensors will be created."
How TensorRT Works,Memory - The Runtime Phase,"At runtime, TensorRT uses relatively little host memory, but can use considerable amounts of device memory. An engine, on deserialization, allocates device memory to store the model weights. Since the serialized engine is almost all weights, its size is a good approximation to the amount of device memory the weights require. An ExecutionContext uses two kinds of device memory: Persistent memory required by some layer implementations - for example, some convolution implementations use edge masks, and this state cannot be shared between contexts as weights are, because its size depends on the layer input shape, which may vary across contexts. This memory is allocated on creation of the execution context, and lasts for its lifetime. Scratch memory, used to hold intermediate results while processing the network. This memory is used for intermediate activation tensors. It is also used for temporary storage required by layer implementations, the bound for which is controlled by IBuilderConfig::setMaxWorkspaceSize(). You may optionally create an execution context without scratch memory using ICudaEngine::createExecutionContextWithoutDeviceMemory() and provide that memory yourself for the duration of network execution. This allows you to share it between multiple contexts that are not running concurrently, or for other uses while inference is not running. The amount of scratch memory required is returned by ICudaEngine::getDeviceMemorySize(). Information about the amount of persistent memory and scratch memory used by the execution context is emitted by the builder when building the network, at severity kINFO. By default, TensorRT allocates device memory directly from CUDA. However, you can attach an implementation of TensorRT’s IGpuAllocator (C++, Python) interface to the builder or runtime and manage device memory yourself. This is useful if your application wants to control all GPU memory and suballocate to TensorRT instead of having TensorRT allocate directly from CUDA. TensorRT’s dependencies (cuDNN and cuBLAS) can occupy large amounts of device memory. TensorRT allows you to control whether these libraries are used for inference by using the TacticSources (C++, Python) attribute in the builder configuration. Note that some layer implementations require these libraries, so that when they are excluded, the network may not be compiled successfully. In addition, PreviewFeature::kDISABLE_EXTERNAL_TACTIC_SOURCES_FOR_CORE_0805 is used to control the usage of cuDNN, cuBLAS, and cuBLASLt in the TensorRT core library. When this flag is set, the TensorRT core library will not use these tactics even if they are specified by IBuilderConfig::setTacticSources(). This flag will not affect the cudnnContext and cublasContext handles passed to the plugins using IPluginV2Ext::attachToContext() if the appropriate tactic sources are set. The CUDA infrastructure and TensorRT’s device code also consume device memory. The amount of memory varies by platform, device, and TensorRT version. You can use cudaGetMemInfo to determine the total amount of device memory in use. TensorRT measures the amount of memory in use before and after critical operations in builder and runtime. These memory usage statistics are printed to TensorRT’s information logger. For example: [MemUsageChange] Init CUDA: CPU +535, GPU +0, now: CPU 547, GPU 1293 (MiB) It indicates the memory use change by CUDA initialization. CPU +535, GPU +0 is the increased amount of memory after running CUDA initialization. The content after now: is the CPU/GPU memory usage snapshot after CUDA initialization. Note: In a multi-tenant situation, the reported memory use by cudaGetMemInfo and TensorRT is prone to race conditions where a new allocation/free done by a different process or a different thread. Since CUDA is not in control of memory on unified-memory devices, the results returned by cudaGetMemInfo may not be accurate on these platforms."
How TensorRT Works,Memory - Lazy Module Loading,Lazy loading is a CUDA feature that can significantly reduce the peak GPU memory usage of TensorRT with negligible (< 1%) performance impact. The memory saved depends on the model and GPU platform. It is enabled by setting the environment variable CUDA_MODULE_LOADING=LAZY. Refer to the CUDA documentation for more information.
How TensorRT Works,Memory - L2 Persistent Cache Management,"NVIDIA Ampere and later architectures support L2 cache persistence, a feature which allows prioritization of L2 cache lines for retention when a line is chosen for eviction. TensorRT can use this to retain activations in cache, reducing DRAM traffic, and power consumption. Cache allocation is per-execution context, enabled using the context’s setPersistentCacheLimit method. The total persistent cache among all contexts (and other components using this feature) should not exceed cudaDeviceProp::persistingL2CacheMaxSize. Refer to the CUDA Best Practices Guide for more information."
How TensorRT Works,Threading,"In general, TensorRT objects are not thread safe; accesses to an object from different threads must be serialized by the client. The expected runtime concurrency model is that different threads will operate on different execution contexts. The context contains the state of the network (activation values, and so on) during execution, so using a context concurrently in different threads results in undefined behavior. To support this model, the following operations are thread safe: Nonmodifying operations on a runtime or engine. Deserializing an engine from a TensorRT runtime. Creating an execution context from an engine. Registering and deregistering plug-ins. There are no thread-safety issues with using multiple builders in different threads; however, the builder uses timing to determine the fastest kernel for the parameters provided, and using multiple builders with the same GPU will perturb the timing and TensorRT’s ability to construct optimal engines. There are no such issues using multiple threads to build with different GPUs."
How TensorRT Works,Determinism,"The TensorRT builder uses timing to find the fastest kernel to implement a given operator. Timing kernels is subject to noise - other work running on the GPU, fluctuations in GPU clock speed, and so on. Timing noise means that on successive runs of the builder, the same implementation may not be selected. In general, different implementations will use a different order of floating point operations, resulting in small differences in the output. The impact of these differences on the final result is usually very small. However, when TensorRT is configured to optimize by tuning over multiple precisions, the difference between an FP16 and an FP32 kernel can be more significant, particularly if the network has not been well regularized or is otherwise sensitive to numerical drift. Other configuration options that can result in a different kernel selection are different input sizes (for example, batch size) or a different optimization point for an input profile (refer to the Working with Dynamic Shapes section). The AlgorithmSelector (C++, Python) interface allows you to force the builder to pick a particular implementation for a given layer. You can use this to ensure that the same kernels are picked by the builder from run to run. For more information, refer to the Algorithm Selection and Reproducible Builds section. After an engine has been built, except for IFillLayer, it is deterministic: providing the same input in the same runtime environment will produce the same output."
How TensorRT Works,IFillLayer Determinism,"When IFillLayer is added to a network using either the RANDOM_UNIFORM or RANDOM_NORMAL operations, the determinism guarantee above is no longer valid. On each invocation, these operations generate tensors based on the RNG state, and then update the RNG state. This state is stored on a per-execution context basis."
